<?xml version="1.0" encoding="UTF-8"?>
<!--
To change this license header, choose License Headers in Project Properties.
To change this template file, choose Tools | Templates
and open the template in the editor.
-->

<!DOCTYPE arrel SYSTEM 'ProvaXML.dtd'>

<arrel>
    <fill>txte</fill>
    <fill2>texte</fill2>
    <fill2>texte</fill2>
    <branca>
        <fill></fill>
        <fill></fill>
        <fill></fill>
    </branca>
</arrel>
